web-scraper-order,web-scraper-start-url,titulo,precio,habitaciones,metros
"1615691488-1004","https://www.lamudi.com.mx/queretaro-arteaga/queretaro/el-refugio-82/casa/for-rent/?page=4","El Refugio casa a estrenar de 3 recamaras y 246 mts2! RAHQRO","$ 15,500","3 Recámaras","246 m² Construidos"
"1615691562-1096","https://www.lamudi.com.mx/queretaro-arteaga/queretaro/el-refugio-82/casa/for-rent/?page=1","Casa con Amenidades en Esquina. El Refugio - Renta","$ 11,000","3 Recámaras","124 m² Construidos"
"1615691279-812","https://www.lamudi.com.mx/queretaro-arteaga/queretaro/el-mirador-92/casa/for-rent/?page=1","Renta una gran casa en Milenio III cerca de av principal","$ 18,000","3 Recámaras","265 m² Construidos"
"1615691372-878","https://www.lamudi.com.mx/queretaro-arteaga/queretaro/juriquilla/casa/for-rent/?page=4","RENTA DUPLEX PLANTA BAJA SAN ISIDRO JURIQUILLA QRO","$ 7,500","2 Recámaras","60 m² Construidos"
"1615691279-799","https://www.lamudi.com.mx/queretaro-arteaga/queretaro/el-mirador-92/casa/for-rent/?page=1","Casa en el mirador amoblada y equipada con 3 dormitorios y 125 mts2! Rahqro","$ 25,000","3 Recámaras","125 m² Construidos"
"1615691562-1086","https://www.lamudi.com.mx/queretaro-arteaga/queretaro/el-refugio-82/casa/for-rent/?page=1","Casa en renta en Zakia queretaro nueva","$ 8,500","3 Recámaras","102 m² Construidos"
"1615691461-996","https://www.lamudi.com.mx/queretaro-arteaga/queretaro/el-refugio-82/casa/for-rent/?page=5","Casa en El Refugio con buena ubicación sin amueblar y 164 mts2! RAHQRO","$ 13,500","3 Recámaras","164 m² Construidos"
"1615691542-1053","https://www.lamudi.com.mx/queretaro-arteaga/queretaro/el-refugio-82/casa/for-rent/?page=2","Casa en renta El Refugio 3 habitaciones AVH","$ 14,000","3 Recámaras","165 m² Construidos"
"1615691542-1060","https://www.lamudi.com.mx/queretaro-arteaga/queretaro/el-refugio-82/casa/for-rent/?page=2","Se renta casa en el refugio 3 recamaras excelente jardin +sala de tv YCC","$ 14,000","3 Recámaras","137 m² Construidos"
"1615691372-885","https://www.lamudi.com.mx/queretaro-arteaga/queretaro/juriquilla/casa/for-rent/?page=4","HERMOSA CASA DE LUJO EN RENTA AMUEBLADA EN SANTA FE JURIQUILLA","$ 25,000","3 Recámaras","207 m² Construidos"
"1615691404-921","https://www.lamudi.com.mx/queretaro-arteaga/queretaro/juriquilla/casa/for-rent/?page=3","ALTOS DE JURIQULLA CASA EN RENTA DE 3 RECAMARAS ROOF GARDEN CUARTO DE SERVICIO","$ 22,000","3 Recámaras","196 m² Construidos"
"1615691562-1099","https://www.lamudi.com.mx/queretaro-arteaga/queretaro/el-refugio-82/casa/for-rent/?page=1","Casa en renta El Refugio 3 habitaciones AVH","$ 14,000","3 Recámaras","165 m² Construidos"
"1615691488-1007","https://www.lamudi.com.mx/queretaro-arteaga/queretaro/el-refugio-82/casa/for-rent/?page=4","El Refugio - Casa para RENTA en calle abierta.","$ 15,500","3 Recámaras","246 m² Construidos"
"1615691316-841","https://www.lamudi.com.mx/queretaro-arteaga/queretaro/milenio-iii-10/casa/for-rent/?page=1","CASA EN RENTA AMUEBLADA EN MILENIO III EN ESQUINA","$ 15,000","2 Recámaras","136 m² Construidos"
"1615691372-882","https://www.lamudi.com.mx/queretaro-arteaga/queretaro/juriquilla/casa/for-rent/?page=4","Renta Casa Amueblada Privada en Juriquilla Cumbres Lago amplio jardin, terraza","$ 29,000","3 Recámaras","165 m² Construidos"
"1615691488-1015","https://www.lamudi.com.mx/queretaro-arteaga/queretaro/el-refugio-82/casa/for-rent/?page=4","Gran casa en Renta. El Refugio. FVR","$ 15,500","3 Recámaras","246 m² Construidos"
"1615691461-979","https://www.lamudi.com.mx/queretaro-arteaga/queretaro/el-refugio-82/casa/for-rent/?page=5","Casa en renta El Refugio 3 habitaciones JGCC","$ 12,500","3 Recámaras","164 m² Construidos"
"1615691279-810","https://www.lamudi.com.mx/queretaro-arteaga/queretaro/el-mirador-92/casa/for-rent/?page=1","CASA EN RENTA DE 3 NIVELES EN RESIDENCIAL DEL PARQUE","$ 12,000","3 Recámaras","119 m² Construidos"
"1615691355-860","https://www.lamudi.com.mx/queretaro-arteaga/queretaro/juriquilla/casa/for-rent/?page=5","Casa con recámara en PB en RENTA","$ 40,000","3 Recámaras","525 m² Construidos"
"1615691542-1075","https://www.lamudi.com.mx/queretaro-arteaga/queretaro/el-refugio-82/casa/for-rent/?page=2","Casa en renta El Refugio 3 habitaciones JGCC","$ 12,500","3 Recámaras","164 m² Construidos"
"1615691316-819","https://www.lamudi.com.mx/queretaro-arteaga/queretaro/milenio-iii-10/casa/for-rent/?page=1","CASA DUPLEX AMUEBLADA EN MILENIO lll INCLUYE SERVICIOS","$ 17,000","3 Recámaras","180 m² Construidos"
"1615691542-1063","https://www.lamudi.com.mx/queretaro-arteaga/queretaro/el-refugio-82/casa/for-rent/?page=2","Casa en Renta Frente a Parque en Queretaro El Refugio","$ 23,000","3 Recámaras","275 m² Construidos"
"1615691241-774","https://www.lamudi.com.mx/queretaro-arteaga/queretaro/el-campanario-28/casa/for-rent/","CASA EN RENTA EN LOMAS DEL CAMPANARIO I CON RECAMARA EN PLANTA BAJA","$ 35,000","4 Recámaras","290 m² Construidos"
"1615691514-1042","https://www.lamudi.com.mx/queretaro-arteaga/queretaro/el-refugio-82/casa/for-rent/?page=3","Casa en Renta en Zakia Queretaro","$ 9,500","3 Recámaras","110 m² Construidos"
"1615691562-1079","https://www.lamudi.com.mx/queretaro-arteaga/queretaro/el-refugio-82/casa/for-rent/?page=1","RENTA CASA EL REFUGIO","$ 12,500","3 Recámaras","130 m² Construidos"
"1615691279-806","https://www.lamudi.com.mx/queretaro-arteaga/queretaro/el-mirador-92/casa/for-rent/?page=1","Casa en renta El Mirador 3 habitaciones AVH","$ 11,500","3 Recámaras","120 m² Construidos"
"1615691337-846","https://www.lamudi.com.mx/queretaro-arteaga/queretaro/juriquilla/casa/for-rent/?page=6","CASA EN RENTA EN JURIQUILLA AMUEBLADA,  DENTRO DE CONDOMINIO","$ 27,000","3 Recámaras","235 m² Construidos"
"1615691404-919","https://www.lamudi.com.mx/queretaro-arteaga/queretaro/juriquilla/casa/for-rent/?page=3","CASA EN RENTA EN JURIQUILLA, CUMBRES DEL LAGO, AMUEBLADA","$ 21,000","2 Recámaras","153 m² Construidos"
"1615691461-984","https://www.lamudi.com.mx/queretaro-arteaga/queretaro/el-refugio-82/casa/for-rent/?page=5","Casa en renta El Refugio 3 habitaciones JRH","$ 12,500","3 Recámaras","164 m² Construidos"
"1615691424-941","https://www.lamudi.com.mx/queretaro-arteaga/queretaro/juriquilla/casa/for-rent/?page=2","RENTA DE CASA EN JARDINES DE JURIQUILLA","$ 16,000","3 Recámaras","220 m² Construidos"
"1615691488-1017","https://www.lamudi.com.mx/queretaro-arteaga/queretaro/el-refugio-82/casa/for-rent/?page=4","Amplia casa en renta en El Refugio","$ 12,500","3 Recámaras","190 m² Construidos"
"1615691488-1013","https://www.lamudi.com.mx/queretaro-arteaga/queretaro/el-refugio-82/casa/for-rent/?page=4","Bella casa en renta (con o sin muebles) en Fray Junipero Serra OFP 20-101","$ 35,000","5 Recámaras","410 m² Construidos"
"1615691316-817","https://www.lamudi.com.mx/queretaro-arteaga/queretaro/milenio-iii-10/casa/for-rent/?page=1","Casa en renta, Milenio III Querétaro","$ 20,000","3 Recámaras","230 m² Construidos"
"1615691442-975","https://www.lamudi.com.mx/queretaro-arteaga/queretaro/juriquilla/casa/for-rent/?page=1","RENTA CASA AMPLIA VALLE DE JURIQUILLA 3 RECAMARAS CERCA HOSPITALES ESCUELAS","$ 15,000","3 Recámaras","180 m² Construidos"
"1615691542-1057","https://www.lamudi.com.mx/queretaro-arteaga/queretaro/el-refugio-82/casa/for-rent/?page=2","Casa sin amueblar en El Refugio de 3 dormitorios! GOC 20-1606","$ 13,000","3 Recámaras","164 m² Construidos"
"1615691316-822","https://www.lamudi.com.mx/queretaro-arteaga/queretaro/milenio-iii-10/casa/for-rent/?page=1","Casa en El Milenio de 3 niveles, sin amoblar y 300 mts2! RAHQRO","$ 16,000","3 Recámaras","300 m² Construidos"
"1615691241-769","https://www.lamudi.com.mx/queretaro-arteaga/queretaro/el-campanario-28/casa/for-rent/","Amplia Casa en Renta","$ 65,000","4 Recámaras","650 m² Construidos"
"1615691461-983","https://www.lamudi.com.mx/queretaro-arteaga/queretaro/el-refugio-82/casa/for-rent/?page=5","Casa en Fracc. El Refigio Qro.  CMC #20-1606","$ 13,000","3 Recámaras","164 m² Construidos"
"1615691355-856","https://www.lamudi.com.mx/queretaro-arteaga/queretaro/juriquilla/casa/for-rent/?page=5","JURIQUILLA CASA EN RENTA EN PRIVADA CON 3 RECAMARAS JARDIN ROOF GARDEN ALBERCA","$ 22,000","3 Recámaras","196 m² Construidos"
"1615691562-1095","https://www.lamudi.com.mx/queretaro-arteaga/queretaro/el-refugio-82/casa/for-rent/?page=1","RENTA CASA EN EL REFUGIO, , BONITA, AMPLIA, EN PRIVADA CON ALBERCA!","$ 10,000","3 Recámaras","158 m² Construidos"
"1615691488-1021","https://www.lamudi.com.mx/queretaro-arteaga/queretaro/el-refugio-82/casa/for-rent/?page=4","Bella casa en renta con amenidades en El Refugio, OFP 19-2439","$ 14,000","3 Recámaras","142 m² Construidos"
"1615691562-1084","https://www.lamudi.com.mx/queretaro-arteaga/queretaro/el-refugio-82/casa/for-rent/?page=1","Casa renta Querétaro el Refugio Hermosa casa  zona en expansión con plusvalía","$ 10,000","3 Recámaras","150 m² Construidos"
"1615691404-909","https://www.lamudi.com.mx/queretaro-arteaga/queretaro/juriquilla/casa/for-rent/?page=3","Amplia y hermosa casa en Renta en Juriquilla en privada con vigilancia JF","$ 40,000","4 Recámaras","525 m² Construidos"
"1615691279-807","https://www.lamudi.com.mx/queretaro-arteaga/queretaro/el-mirador-92/casa/for-rent/?page=1","Renta de Casa Equipada en Privada Muy Bien Ubicada - El Mirador","$ 11,500","3 Recámaras","120 m² Construidos"
"1615691424-933","https://www.lamudi.com.mx/queretaro-arteaga/queretaro/juriquilla/casa/for-rent/?page=2","RENTA CASAS QUERETARO JURIQUILLA LA RICA  AA","$ 55,000","4 Recámaras","550 m² Construidos"
"1615691372-892","https://www.lamudi.com.mx/queretaro-arteaga/queretaro/juriquilla/casa/for-rent/?page=4","Departamento Duplex en renta, posee dos recamaras,con alberca y GYM, YCC","$ 14,000","2 Recámaras","156 m² Construidos"
"1615691442-964","https://www.lamudi.com.mx/queretaro-arteaga/queretaro/juriquilla/casa/for-rent/?page=1","Casa en condominio en Renta, en Juriquilla, Querétaro","$ 13,000","3 Recámaras","159 m² Construidos"
"1615691442-954","https://www.lamudi.com.mx/queretaro-arteaga/queretaro/juriquilla/casa/for-rent/?page=1","C206 Monisima casa amueblada o sin amueblar, jacuzzi, priv. vig 24 Excelente $","$ 15,000","3 Recámaras","130 m² Construidos"
"1615691279-809","https://www.lamudi.com.mx/queretaro-arteaga/queretaro/el-mirador-92/casa/for-rent/?page=1","Casa en renta con 3 recamaras en el Mirador Provenza YCC","$ 10,500","3 Recámaras","90 m² Construidos"
"1615691279-808","https://www.lamudi.com.mx/queretaro-arteaga/queretaro/el-mirador-92/casa/for-rent/?page=1","Casa en Renta en Residencial del parque 3 recamaras, YCC","$ 12,000","3 Recámaras","119 m² Construidos"
"1615691262-789","https://www.lamudi.com.mx/queretaro-arteaga/queretaro/el-mirador-92/casa/for-rent/?page=2","Álamos 3a Sección, Querétaro","$ 11,500","3 Recámaras","120 m² Construidos"
"1615691355-868","https://www.lamudi.com.mx/queretaro-arteaga/queretaro/juriquilla/casa/for-rent/?page=5","Se renta amplia casa en juriquilla estilo colonial 3 recamaras 4 baños","$ 18,000","3 Recámaras","312 m² Construidos"
"1615691488-1002","https://www.lamudi.com.mx/queretaro-arteaga/queretaro/el-refugio-82/casa/for-rent/?page=4","Amplia casa en El Refugio de 3 recamaras y 3 niveles!","$ 15,500","3 Recámaras","246 m² Construidos"
"1615691404-910","https://www.lamudi.com.mx/queretaro-arteaga/queretaro/juriquilla/casa/for-rent/?page=3","Casa en Renta Querétaro San Isidro Juriquilla dentro de condominio privado","$ 10,500","3 Recámaras","120 m² Construidos"
"1615691514-1032","https://www.lamudi.com.mx/queretaro-arteaga/queretaro/el-refugio-82/casa/for-rent/?page=3","Casa en renta en El Refugio de 3 recamaras sin Amueblar RAHQRO","$ 14,000","3 Recámaras","190 m² Construidos"
"1615691355-869","https://www.lamudi.com.mx/queretaro-arteaga/queretaro/juriquilla/casa/for-rent/?page=5","Casa en renta Cumbres de Juriquilla","$ 15,000","3 Recámaras","180 m² Construidos"
"1615691442-957","https://www.lamudi.com.mx/queretaro-arteaga/queretaro/juriquilla/casa/for-rent/?page=1","SE RENTA CASA EN JURIQUILLA DENTRO DE PRIVADA","$ 13,000","3 Recámaras","140 m² Construidos"
"1615691316-823","https://www.lamudi.com.mx/queretaro-arteaga/queretaro/milenio-iii-10/casa/for-rent/?page=1","Rento casa Milenio, 4 recamaras, 5 baños, estudio PB, Roof, amplios espacios","$ 15,000","4 Recámaras","220 m² Construidos"
"1615691372-888","https://www.lamudi.com.mx/queretaro-arteaga/queretaro/juriquilla/casa/for-rent/?page=4","BAJA SU PRECIO Casa en venta en privada de 6 casas en Juriquilla Queretaro","$ 17,000,000","4 Recámaras","725 m² Construidos"
"1615691461-989","https://www.lamudi.com.mx/queretaro-arteaga/queretaro/el-refugio-82/casa/for-rent/?page=5","Casa en renta El Refugio 3 habitaciones YCC","$ 14,000","3 Recámaras","155 m² Construidos"
"1615691279-802","https://www.lamudi.com.mx/queretaro-arteaga/queretaro/el-mirador-92/casa/for-rent/?page=1","Casa bonita en renta ubicada en El Mirador con 2 recámaras JF","$ 11,500","2 Recámaras","127 m² Construidos"
"1615691404-913","https://www.lamudi.com.mx/queretaro-arteaga/queretaro/juriquilla/casa/for-rent/?page=3","CASA EN JURIQUILLA","$ 12,000","3 Recámaras","null"
"1615691372-890","https://www.lamudi.com.mx/queretaro-arteaga/queretaro/juriquilla/casa/for-rent/?page=4","Casa en Renta  SAN ISIDRO JURIQUILLA Querétaro 2 habitaciones cada una con baño","$ 8,500","2 Recámaras","100 m² Construidos"
"1615691337-843","https://www.lamudi.com.mx/queretaro-arteaga/queretaro/juriquilla/casa/for-rent/?page=6","Casa Amoblada en renta en Altos de juriquilla AQC","$ 22,000","3 Recámaras","196 m² Construidos"
"1615691355-866","https://www.lamudi.com.mx/queretaro-arteaga/queretaro/juriquilla/casa/for-rent/?page=5","Estrena Casa en condominio en venta con doble seguridad,Lomas de Juriquilla,QRO.","Contactar agente para saber precio","3 Recámaras","207 m² Construidos"
"1615691279-801","https://www.lamudi.com.mx/queretaro-arteaga/queretaro/el-mirador-92/casa/for-rent/?page=1","Casa amueblada en El Mirador de 3 recamaras! RAHQRO 20-3384","$ 10,500","3 Recámaras","91 m² Construidos"
"1615691488-1020","https://www.lamudi.com.mx/queretaro-arteaga/queretaro/el-refugio-82/casa/for-rent/?page=4","Amplia casa en renta de 3 recamaras en el Refugio 20-3531JVE","$ 15,500","3 Recámaras","246 m² Construidos"
"1615691488-1018","https://www.lamudi.com.mx/queretaro-arteaga/queretaro/el-refugio-82/casa/for-rent/?page=4","Renta de casa en El Refugio","$ 10,000","3 Recámaras","125 m² Construidos"
"1615691488-1014","https://www.lamudi.com.mx/queretaro-arteaga/queretaro/el-refugio-82/casa/for-rent/?page=4","Casa en renta El Refugio 3 habitaciones JRH","$ 15,000","3 Recámaras","180 m² Construidos"
"1615691562-1077","https://www.lamudi.com.mx/queretaro-arteaga/queretaro/el-refugio-82/casa/for-rent/?page=1","CASA AMUEBLADA EN RENTA EN EL REFUGIO","$ 14,000","3 Recámaras","142 m² Construidos"
"1615691461-982","https://www.lamudi.com.mx/queretaro-arteaga/queretaro/el-refugio-82/casa/for-rent/?page=5","Casa en Esquina con Buenos Acabados - El Refugio. Renta","$ 15,500","3 Recámaras","246 m² Construidos"
"1615691442-956","https://www.lamudi.com.mx/queretaro-arteaga/queretaro/juriquilla/casa/for-rent/?page=1","JURIQUILLA RENTA DEPARTAMENTO 3 RECAMARAS / ATELIER","$ 12,500","3 Recámaras","91 m² Construidos"
"1615691488-1025","https://www.lamudi.com.mx/queretaro-arteaga/queretaro/el-refugio-82/casa/for-rent/?page=4","Casa en El Refugio sin amoblar de 3 dormitorios y 164 mts2 en renta! GOC","$ 13,500","3 Recámaras","164 m² Construidos"
"1615691424-934","https://www.lamudi.com.mx/queretaro-arteaga/queretaro/juriquilla/casa/for-rent/?page=2","Casa en Renta en Juriquilla con cuarto de servicio","$ 15,000","3 Recámaras","230 m² Construidos"
"1615691461-977","https://www.lamudi.com.mx/queretaro-arteaga/queretaro/el-refugio-82/casa/for-rent/?page=5","Casa en renta El Refugio 3 habitaciones JGCC","$ 12,500","3 Recámaras","164 m² Construidos"
"1615691514-1031","https://www.lamudi.com.mx/queretaro-arteaga/queretaro/el-refugio-82/casa/for-rent/?page=3","CASA EN RENTA EN RESIDENCIAL EL REFUGIO DENTRO DE CONDOMINIO CON AMENIDADES","$ 12,500","3 Recámaras","120 m² Construidos"
"1615691514-1027","https://www.lamudi.com.mx/queretaro-arteaga/queretaro/el-refugio-82/casa/for-rent/?page=3","Amplia casa en renta de 3 recámaras cada una con baño en El Refugio 20-3531","$ 18,500","3 Recámaras","246 m² Construidos"
"1615691461-981","https://www.lamudi.com.mx/queretaro-arteaga/queretaro/el-refugio-82/casa/for-rent/?page=5","Renta - Casa con Control de Acceso y Amenidades, El Refugio","$ 12,500","3 Recámaras","190 m² Construidos"
"1615691424-942","https://www.lamudi.com.mx/queretaro-arteaga/queretaro/juriquilla/casa/for-rent/?page=2","CASA  RENTA EN JURIQUILLA, EXCELENTE ILUMINACIÓN JARDIN 3 RECS CUARTO SERVICO","$ 30,000","3 Recámaras","450 m² Construidos"
"1615691337-848","https://www.lamudi.com.mx/queretaro-arteaga/queretaro/juriquilla/casa/for-rent/?page=6","LOFT EN RENTA JURIQUILLA EN CONJUNTO CERRADO CON VIGILANCIA LAS 24HRS.","$ 13,000","1 Recámara","110 m² Construidos"
"1615691316-833","https://www.lamudi.com.mx/queretaro-arteaga/queretaro/milenio-iii-10/casa/for-rent/?page=1","Casa de tres niveles en Milenio III con 3 dormitorios y 300 mts2! JGJ","$ 15,000","3 Recámaras","300 m² Construidos"
"1615691404-914","https://www.lamudi.com.mx/queretaro-arteaga/queretaro/juriquilla/casa/for-rent/?page=3","RENTA DE CASA EN VALLE DE JURIQUILLA","$ 19,000","3 Recámaras","200 m² Construidos"
"1615691372-877","https://www.lamudi.com.mx/queretaro-arteaga/queretaro/juriquilla/casa/for-rent/?page=4","Casa Amueblada en renta, exclusivo condominio en valle de juriquilla","$ 23,000","3 Recámaras","171 m² Construidos"
"1615691562-1093","https://www.lamudi.com.mx/queretaro-arteaga/queretaro/el-refugio-82/casa/for-rent/?page=1","CASA EN RENTA CH EN VIDARA, RESIDENCIAL EL REFUGIO, QUERÉTARO","$ 9,000","2 Recámaras","110 m² Construidos"
"1615691461-986","https://www.lamudi.com.mx/queretaro-arteaga/queretaro/el-refugio-82/casa/for-rent/?page=5","Casa de 3 Recámaras en Renta Dentro de Privada en El Refugio SRM 21-3240","$ 12,500","3 Recámaras","190 m² Construidos"
"1615691337-845","https://www.lamudi.com.mx/queretaro-arteaga/queretaro/juriquilla/casa/for-rent/?page=6","AV/  Renta Casa en Av. La rica  Juriquilla Querétaro","$ 40,000","4 Recámaras","284 m² Construidos"
"1615691355-872","https://www.lamudi.com.mx/queretaro-arteaga/queretaro/juriquilla/casa/for-rent/?page=5","Casa en renta en Altos de juriquilla Amueblada 3 recamaras y Roof","$ 19,000","3 Recámaras","196 m² Construidos"
"1615691562-1100","https://www.lamudi.com.mx/queretaro-arteaga/queretaro/el-refugio-82/casa/for-rent/?page=1","Casa en renta amueblada con 3 recámaras en El Refugio.","$ 19,000","3 Recámaras","180 m² Construidos"
"1615691442-958","https://www.lamudi.com.mx/queretaro-arteaga/queretaro/juriquilla/casa/for-rent/?page=1","RENTA O VENTA CASA AMUEBLADA EN CUMBRES DEL LAGO JURIQUILLA","$ 35,000","3 Recámaras","300 m² Construidos"
"1615691241-776","https://www.lamudi.com.mx/queretaro-arteaga/queretaro/el-campanario-28/casa/for-rent/","EXTRAORDINARIA CASA EN RENTA LOMAS 1","$ 38,000","3 Recámaras","307 m² Construidos"
"1615691241-779","https://www.lamudi.com.mx/queretaro-arteaga/queretaro/el-campanario-28/casa/for-rent/","RESIDENCIA EN VENTA CON HERMOSA VISTA AL LAGO","$ 70,000","3 Recámaras","514 m² Construidos"
"1615691562-1092","https://www.lamudi.com.mx/queretaro-arteaga/queretaro/el-refugio-82/casa/for-rent/?page=1","Casa en Renta Queretaro Vidanta El Refugio","$ 10,000","2 Recámaras","120 m² Construidos"
"1615691316-834","https://www.lamudi.com.mx/queretaro-arteaga/queretaro/milenio-iii-10/casa/for-rent/?page=1","Milenio, amplia casa de tres niveles para renta. FVR","$ 16,000","3 Recámaras","300 m² Construidos"
"1615691372-884","https://www.lamudi.com.mx/queretaro-arteaga/queretaro/juriquilla/casa/for-rent/?page=4","Casa en Murano","$ 13,500","3 Recámaras","159 m² Construidos"
"1615691279-811","https://www.lamudi.com.mx/queretaro-arteaga/queretaro/el-mirador-92/casa/for-rent/?page=1","Se renta casa de 3 recamaras  3 baños en el mirador buena ubicacion","$ 12,000","3 Recámaras","119 m² Construidos"
"1615691542-1076","https://www.lamudi.com.mx/queretaro-arteaga/queretaro/el-refugio-82/casa/for-rent/?page=2","Casa de 3 Recámaras, Mantenimiento Incluido El Refigio Querétaro.  CMC #20-1606","$ 13,000","3 Recámaras","164 m² Construidos"
"1615691404-902","https://www.lamudi.com.mx/queretaro-arteaga/queretaro/juriquilla/casa/for-rent/?page=3","Renta Casa en Juriquilla","$ 35,000","3 Recámaras","310 m² Construidos"
"1615691424-937","https://www.lamudi.com.mx/queretaro-arteaga/queretaro/juriquilla/casa/for-rent/?page=2","Casas en Renta en Juriquilla","$ 11,500","3 Recámaras","170 m² Construidos"
"1615691542-1054","https://www.lamudi.com.mx/queretaro-arteaga/queretaro/el-refugio-82/casa/for-rent/?page=2","Casa en condominio en Renta, en Residencial el Refugio, Querétaro","$ 13,500","3 Recámaras","236 m² Construidos"
"1615691262-786","https://www.lamudi.com.mx/queretaro-arteaga/queretaro/el-mirador-92/casa/for-rent/?page=2","Casa en El Mirador AMOBLADO con todos los servicios y 3 dormitorios! RAH","$ 25,000","3 Recámaras","125 m² Construidos"
"1615691372-894","https://www.lamudi.com.mx/queretaro-arteaga/queretaro/juriquilla/casa/for-rent/?page=4","Casa - Juriquilla","$ 14,000","3 Recámaras","155 m² Construidos"
"1615691424-928","https://www.lamudi.com.mx/queretaro-arteaga/queretaro/juriquilla/casa/for-rent/?page=2","CASA EN RENTA EN JURIQUILLA, FRENTE A SUPERAMA","$ 11,800","3 Recámaras","164 m² Construidos"
"1615691542-1052","https://www.lamudi.com.mx/queretaro-arteaga/queretaro/el-refugio-82/casa/for-rent/?page=2","Casa en Renta en El Refugio Querétaro","$ 12,500","3 Recámaras","160 m² Construidos"
"1615691262-781","https://www.lamudi.com.mx/queretaro-arteaga/queretaro/el-mirador-92/casa/for-rent/?page=2","Hermosa casa dentro del mirador y en privada, con amenidades.","$ 11,500","3 Recámaras","120 m² Construidos"
"1615691404-923","https://www.lamudi.com.mx/queretaro-arteaga/queretaro/juriquilla/casa/for-rent/?page=3","Casa Equipada y con Jardín Para Estrenar, San Isidro Juriquilla - Renta","$ 12,000","3 Recámaras","123 m² Construidos"
"1615691355-873","https://www.lamudi.com.mx/queretaro-arteaga/queretaro/juriquilla/casa/for-rent/?page=5","Excelente casa en renta en Juriquilla","$ 15,000","3 Recámaras","null"
"1615691488-1023","https://www.lamudi.com.mx/queretaro-arteaga/queretaro/el-refugio-82/casa/for-rent/?page=4","Casa en renta El Refugio 3 habitaciones JGCC","$ 12,500","3 Recámaras","164 m² Construidos"
"1615691372-898","https://www.lamudi.com.mx/queretaro-arteaga/queretaro/juriquilla/casa/for-rent/?page=4","AA/ CAS RENTA JURIQUILLA QUERETARO JARDINES DE JURIQUILLA","$ 15,500","3 Recámaras","200 m² Construidos"
"1615691442-966","https://www.lamudi.com.mx/queretaro-arteaga/queretaro/juriquilla/casa/for-rent/?page=1","CASA  RENTA VILLAS DE JURIQUILLA STA FE QUERETARO","$ 11,500","2 Recámaras","142 m² Construidos"
"1615691461-1000","https://www.lamudi.com.mx/queretaro-arteaga/queretaro/el-refugio-82/casa/for-rent/?page=5","En Renta Amplia casa ubicada en el corazon del Refugio","$ 14,000","3 Recámaras","155 m² Construidos"
"1615691241-770","https://www.lamudi.com.mx/queretaro-arteaga/queretaro/el-campanario-28/casa/for-rent/","Casa en renta El Campanario 4 habitaciones JGCC","$ 35,000","4 Recámaras","313 m² Construidos"
"1615691372-899","https://www.lamudi.com.mx/queretaro-arteaga/queretaro/juriquilla/casa/for-rent/?page=4","HERMOSA CASA EN VENTA UBICADA EN JURIQUILLA CAMPESTRE !!","$ 19,000","3 Recámaras","222 m² Construidos"
"1615691355-855","https://www.lamudi.com.mx/queretaro-arteaga/queretaro/juriquilla/casa/for-rent/?page=5","Casa en Renta - Juriquilla - en Privada","$ 28,000","3 Recámaras","415 m² Construidos"
"1615691372-886","https://www.lamudi.com.mx/queretaro-arteaga/queretaro/juriquilla/casa/for-rent/?page=4","Casa - Fraccionamiento La Cañada Juriquilla","$ 50,000","3 Recámaras","429 m² Construidos"
"1615691355-858","https://www.lamudi.com.mx/queretaro-arteaga/queretaro/juriquilla/casa/for-rent/?page=5","Casa amueblada en renta en Balcones Juriquilla, Queretaro","$ 45,000","3 Recámaras","340 m² Construidos"
"1615691262-780","https://www.lamudi.com.mx/queretaro-arteaga/queretaro/el-mirador-92/casa/for-rent/?page=2","Casa en El Mirador amoblada con servicios, 125 mts2 y 3 dormitorios! RAHQRO","$ 25,000","3 Recámaras","125 m² Construidos"
"1615691488-1012","https://www.lamudi.com.mx/queretaro-arteaga/queretaro/el-refugio-82/casa/for-rent/?page=4","Casa amoblado en El Refugio con cocina equipada y 3 dormitorios! RCS","$ 14,500","3 Recámaras","140 m² Construidos"
"1615691279-792","https://www.lamudi.com.mx/queretaro-arteaga/queretaro/el-mirador-92/casa/for-rent/?page=1","Hermosa casa en Renta dentro de El Mirador","$ 11,500","3 Recámaras","120 m² Construidos"
"1615691488-1003","https://www.lamudi.com.mx/queretaro-arteaga/queretaro/el-refugio-82/casa/for-rent/?page=4","El Refugio, casa en renta a pie de calle. FVR","$ 13,500","3 Recámaras","164 m² Construidos"
"1615691279-793","https://www.lamudi.com.mx/queretaro-arteaga/queretaro/el-mirador-92/casa/for-rent/?page=1","Casa amoblado en el mirador de 158 mts2 y 3 dormitorios! Rahqro","$ 25,000","3 Recámaras","158 m² Construidos"
"1615691355-865","https://www.lamudi.com.mx/queretaro-arteaga/queretaro/juriquilla/casa/for-rent/?page=5","RENTA DE CASA EN JURIQUILLA","$ 15,000","3 Recámaras","227 m² Construidos"
